ID,Device Name,Measurement Type,Description
1,Water Meter,Water Consumption,"Measures water consumption in a building or area."
2,Gas Meter,Gas Consumption,"Monitors gas consumption for residential or commercial use."
3,Smart Street Light,Street Lighting,"Adjusts public street lighting based on the presence of people or vehicles."
4,Smart Parking Sensor,Parking Occupancy,"Detects whether a parking space is occupied or available in real-time."
5,Traffic Flow Sensor,Traffic,"Monitors traffic flow and congestion in real-time."
6,Air Quality Sensor,Air Quality,"Measures atmospheric pollution levels such as PM2.5, PM10, CO2, and VOCs."
7,Noise Level Sensor,Noise Pollution,"Monitors noise levels in urban areas to detect acoustic pollution."
8,Weather Station,Weather Conditions,"Monitors weather conditions such as temperature, humidity, wind, rain, and atmospheric pressure."
9,Smart Waste Bin,Waste Management,"Monitors the fill level of waste bins for efficient waste collection."
10,Smart Water Pump,Water Management,"Controls water flow in distribution networks based on demand."
11,Flood Detection Sensor,Flood Alarm,"Monitors water levels in flood-prone areas."
12,Soil Moisture Sensor,Soil Moisture,"Measures soil moisture content to optimize irrigation in urban areas."
13,Smart Grid Energy Meter,Energy Consumption,"Monitors and manages electricity usage in smart city energy grids."
14,Energy Consumption Monitor,Energy Consumption,"Monitors energy consumption in buildings or urban areas for optimization."
15,Smart Bus Stop,Public Transport,"Real-time information on public transport arrival times."
16,Smart Traffic Light,Traffic Lights,"Adjusts traffic lights based on traffic flow to optimize mobility."
17,Air Pollution Sensor,Air Pollution,"Monitors urban air quality by measuring pollutants in the atmosphere."
18,Smart Building Management,Building Management,"Controls HVAC systems, lighting, and security in urban buildings."
19,Smart Grid Sensor,Smart Grid,"Monitors smart grids to optimize energy distribution in cities."
20,Smart Water Leak Detector,Water Leak Detection,"Detects water leaks in urban water supply networks to prevent waste."
21,Smart CCTV Camera,Surveillance,"Monitors public areas with intelligent cameras and motion detection."
22,Public Transport Sensor,Public Transport,"Tracks the real-time location of public transportation to optimize routes."
23,Wind Speed Sensor,Wind Speed,"Monitors wind speed in urban areas or along coastlines."
24,UV Index Sensor,UV Radiation,"Monitors UV index to inform the population about sun exposure risks."
25,Water Quality Sensor,Water Quality,"Monitors chemical and biological parameters of water to ensure its quality."
26,Smart Traffic Monitoring,Traffic Monitoring,"Uses cameras and sensors to collect data on traffic to optimize flow."
27,Parking Occupancy Sensor,Parking Occupancy,"Monitors parking space availability in real-time."
28,Smart Wastewater Sensor,Wastewater Management,"Monitors levels and quality of wastewater in sewer networks."
29,Air Temperature Sensor,Air Temperature,"Monitors air temperature in different urban zones for climate studies."
30,Pedestrian Counting Sensor,Pedestrian Flow,"Counts the number of pedestrians passing a specific point in the city."
31,Noise Pollution Sensor,Noise Pollution,"Monitors noise levels in different city areas to ensure compliance with noise regulations."
32,Light Pollution Sensor,Light Pollution,"Monitors light pollution in urban areas to improve quality of life at night."
33,Vehicle Emissions Sensor,Vehicle Emissions,"Monitors the emissions from vehicles circulating in the city."
34,Smart Floodgate Controller,Floodgate Control,"Adjusts floodgates in flood-prone areas based on water levels."
35,Street Furniture Monitor,Street Furniture,"Monitors the condition and functionality of urban street furniture such as benches and bins."
36,Smart Signage,Smart Signage,"Displays real-time information on traffic, events, or emergencies on digital signs."
37,Smart Irrigation System,Smart Irrigation,"Controls and optimizes irrigation in public parks and green areas in the city."
38,Bridge Monitoring Sensor,Bridge Monitoring,"Monitors the structural health of bridges in the city to prevent damage."
39,Smart Bicycle Sharing System,Bike Sharing,"Monitors availability and condition of shared bicycles in the city."
40,Building Energy Efficiency Sensor,Building Efficiency,"Monitors the energy efficiency of buildings to optimize consumption."
41,Smart Air Ventilation,Air Ventilation,"Optimizes ventilation systems in public buildings to ensure indoor air quality."
42,Traffic Noise Sensor,Traffic Noise,"Monitors traffic-related noise pollution in urban environments."
43,Public Lighting Sensor,Street Lighting,"Adjusts street lighting intensity based on time of day and environmental conditions."
44,Smart Water Distribution,Water Distribution,"Optimizes the distribution of water in urban areas based on demand and leaks."
45,Smart Tunnel Monitoring,Tunnel Monitoring,"Monitors pollution levels and safety conditions in urban road tunnels."
46,Smart Tree Monitoring,Tree Health,"Monitors the health of trees in urban areas to prevent accidents or damage."
47,Public Safety Sensor,Public Safety,"Monitors public areas for safety using motion detection and surveillance."
48,Smart Weather Forecasting,Weather Forecasting,"Provides localized weather forecasts to improve city planning and management."
49,Seismic Activity Sensor,Seismic Monitoring,"Monitors seismic activity to ensure safety in case of earthquakes."
50,Smart Road Surface Monitor,Surface Monitoring,"Monitors road surface conditions to plan for maintenance or repairs."
51,Smart Air Quality Monitoring,Air Quality,"Monitors fine particulate matter, ozone, and carbon monoxide in urban air."
52,Smart Traffic Flow Optimization,Traffic,"Collects data to optimize traffic signals and traffic flow in real-time."
53,Smart Parking Guidance,Parking,"Provides real-time parking space availability information to drivers."
54,Urban Heat Island Sensor,Urban Heat,"Measures temperature variations in urban areas to mitigate the heat island effect."
55,Smart Waste Management,Smart Waste,"Monitors waste bins, optimizing trash collection and reducing carbon footprint."
56,Smart Traffic Data Collection,Traffic,"Gathers traffic data to improve transportation systems and planning."
57,Smart Electric Vehicle Charger,Electric Vehicles,"Monitors and controls the charging process for electric vehicles in the city."
58,Smart Water Quality Monitoring,Water Quality,"Continuously monitors water quality in urban water bodies and reservoirs."
59,Smart Flood Detection,Flood Alarm,"Detects flood risks by monitoring river and rainwater levels in critical areas."
60,Smart Street Furniture Maintenance,Street Furniture,"Monitors and reports on the condition of public street furniture like benches and bins."
61,Smart Building Temperature Control,Building Management,"Monitors and adjusts the temperature of public buildings for comfort and efficiency."
62,Smart Fire Detection,Fire Safety,"Detects fire hazards using smoke and temperature sensors, sending alerts in real-time."
63,Smart Street Trash Bin,Trash Management,"Monitors waste levels in street trash bins, notifying when bins are full."
64,Smart Building Air Quality,Indoor Air Quality,"Monitors and improves air quality inside urban buildings using sensors."
65,Smart Urban Garden,Urban Agriculture,"Monitors soil conditions, weather, and plant health in urban gardens."
66,Smart Street Light Power Control,Street Lighting,"Optimizes streetlight energy consumption based on traffic and weather."
67,Smart Water Meter,Water Consumption,"Monitors and optimizes water usage in urban areas and residential buildings."
68,Smart Sewerage System,Sewerage Management,"Monitors the status and health of urban sewage and drainage systems."
69,Smart Water Leak Detection,Water Leak,"Detects and locates water leaks in underground pipelines in real-time."
70,Smart Bus Arrival Prediction,Public Transport,"Uses sensors to predict bus arrivals in real-time for commuters."
71,Smart Solar Panel,Renewable Energy,"Monitors and optimizes the performance of solar energy systems in urban areas."
72,Smart Greenhouse,Urban Agriculture,"Optimizes environmental conditions for urban agriculture using smart sensors."
73,Smart Pavement Monitoring,Pavement Health,"Monitors the health of urban pavements and alerts for maintenance needs."
74,Smart Urban Noise Monitoring,Noise Pollution,"Monitors and reports noise levels across the city to ensure compliance with regulations."
75,Smart Smart Grid Voltage Control,Smart Grid,"Monitors and adjusts the voltage in the urban electricity grid to avoid outages."
76,Smart Construction Site,Construction Monitoring,"Monitors construction sites for safety, noise, and environmental impact."
77,Smart Tree Health Monitoring,Tree Health,"Monitors urban trees for health issues, pests, and disease prevention."
78,Smart Bus Stop Lighting,Public Transport,"Adjusts lighting in bus stops based on time of day and weather."
79,Smart Playground,Playground Monitoring,"Monitors playground safety and equipment usage in public parks."
80,Smart Emergency Alert System,Public Safety,"Sends real-time alerts to citizens during emergencies such as fires or floods."
81,Smart School Safety,Public Safety,"Monitors school areas for security, student movement, and emergency situations."
82,Smart Street Monitoring,Street Safety,"Uses sensors and cameras to monitor public streets for safety hazards."
83,Smart Airflow Monitoring,Indoor Air Quality,"Monitors air circulation in public buildings to ensure comfort and safety."
84,Smart Vehicle Tracking,Traffic Monitoring,"Tracks vehicle movement in real-time to optimize traffic management."
85,Smart Heatwave Detection,Weather Monitoring,"Monitors and predicts heatwaves to ensure public safety during extreme heat events."
86,Smart Pedestrian Safety,Public Safety,"Monitors pedestrian activity and alerts drivers in real-time to avoid accidents."
87,Smart Public Restroom Management,Public Facilities,"Monitors public restrooms' availability, cleanliness, and maintenance needs."
88,Smart Noise Barrier,Noise Pollution,"Monitors and adjusts noise barriers to reduce urban noise pollution."
89,Smart Evacuation System,Public Safety,"Monitors and manages public evacuations during natural disasters or emergencies."
90,Smart Bicycle Parking,Transport,"Monitors and optimizes bicycle parking in urban areas."
91,Smart Pedestrian Signal,Traffic,"Adjusts pedestrian signals based on real-time foot traffic."
92,Smart Smart Trash Compactor,Waste Management,"Optimizes trash compacting in waste bins to improve waste collection efficiency."
93,Smart Urban Mobility,Transport,"Monitors and optimizes the movement of people and vehicles in urban spaces."
94,Smart City Pollution Sensor,Environmental Monitoring,"Monitors pollution levels in urban environments to optimize air quality."
95,Smart Flood Warning,Flood Alarm,"Warns citizens of impending floods by monitoring water levels in key locations."
96,Smart Public Transport Station,Public Transport,"Monitors real-time data from public transport stations to optimize scheduling."
97,Smart Urban Cooling System,Urban Heat,"Monitors and adjusts urban cooling systems to reduce heat during summer months."
98,Smart Building Lighting Control,Building Efficiency,"Monitors and optimizes lighting systems in public buildings."
99,Smart Weather Sensors,Weather Conditions,"Monitors environmental conditions such as wind speed, humidity, and temperature."
100,Smart Wastewater Monitoring,Wastewater Management,"Monitors the quality of wastewater in urban systems to ensure safe disposal."
101,Smart Smart City Hub,Urban Management,"Integrates various IoT devices and systems for comprehensive city management and optimization."
102,Smart Electric Scooter Tracking,Transport,"Tracks the location and usage of shared electric scooters."
103,Smart Urban Farming,Urban Agriculture,"Monitors crop growth and soil health in urban farming systems."
104,Smart Street Camera,Surveillance,"Monitors streets with high-definition cameras to enhance security."
105,Smart Garbage Collection,Waste Management,"Optimizes garbage collection routes based on bin usage data."
106,Smart Energy Storage,Energy,"Monitors and optimizes the use of energy storage systems in urban areas."
107,Smart Heatmap Sensor,Urban Heat,"Creates heatmaps of temperature variations to detect areas of high heat."
108,Smart Underground Tunnel Sensor,Tunnel Monitoring,"Monitors environmental conditions and structural integrity of underground tunnels."
109,Smart Citizen Feedback System,Public Engagement,"Gathers real-time feedback from citizens to improve public services."
110,Smart Traffic Congestion Sensor,Traffic,"Monitors real-time traffic congestion to optimize city traffic flow."
111,Smart Pedestrian Crossing,Traffic,"Monitors pedestrian crossings to ensure safety and prevent accidents."
112,Smart Carpark Navigation,Parking,"Guides drivers to available parking spots using real-time data."
113,Smart Solar-Powered Light,Street Lighting,"Powers street lights with solar energy, reducing electricity consumption."
114,Smart Urban Wind Turbine,Renewable Energy,"Generates renewable energy using wind power in urban environments."
115,Smart City Infrastructure Monitoring,Infrastructure,"Monitors the condition of infrastructure like roads, bridges, and public buildings."
116,Smart Urban Heat Detection,Urban Heat,"Detects areas of excessive heat in the city and implements cooling measures."
117,Smart City Water Usage,Water Consumption,"Optimizes water usage across different sectors of the city."
118,Smart Flood Risk Prediction,Flood Monitoring,"Predicts flood risks by monitoring rainfall and water levels in rivers."
119,Smart Vehicle Parking,Parking,"Monitors vehicle parking availability and usage to reduce traffic congestion."
120,Smart Dustbin Monitoring,Waste Management,"Monitors the fill level of dustbins and notifies when they need emptying."
121,Smart Air Purification,Indoor Air Quality,"Improves indoor air quality in buildings using air purification systems."
122,Smart Environmental Monitoring,Environmental Monitoring,"Monitors environmental data such as temperature, humidity, and pollution levels."
123,Smart Smart Grid Management,Energy,"Monitors and manages energy consumption across the smart city grid."
124,Smart Water Conservation System,Water Conservation,"Monitors water usage and alerts when excess consumption occurs."
125,Smart Noise Level Monitoring,Noise Pollution,"Monitors noise levels across the city to manage noise pollution."
126,Smart Security System,Security,"Monitors urban areas for security threats using sensors and cameras."
127,Smart Solar Energy Monitoring,Renewable Energy,"Monitors the output and efficiency of solar energy systems."
128,Smart Building Efficiency,Building Management,"Optimizes energy usage and building operations for efficiency."
129,Smart Public Transport App,Public Transport,"Provides commuters with real-time information on public transport availability."
130,Smart Flood Management,Flood Monitoring,"Monitors and manages flood risks in urban environments."
131,Smart Public Space Usage,Public Space,"Monitors the use of public spaces to optimize maintenance and usage."
132,Smart Rainwater Harvesting,Water Management,"Monitors and optimizes the use of rainwater harvesting systems."
133,Smart Digital Signage,Smart Signage,"Displays real-time information about events, weather, and traffic on public screens."
134,Smart Wastewater Treatment,Water Treatment,"Monitors the treatment of wastewater to ensure compliance with environmental standards."
135,Smart Parking Enforcement,Parking,"Monitors parking violations and sends alerts to law enforcement."
136,Smart Urban Wildlife Monitoring,Wildlife Conservation,"Monitors wildlife activity and urban biodiversity."
137,Smart Pedestrian Pathways,Pedestrian Safety,"Monitors pedestrian pathways and alerts drivers about pedestrian activity."
138,Smart Street Waste Bin,Waste Management,"Monitors waste fill levels in street bins to optimize collection routes."
139,Smart Smart Water Pump,Water Management,"Controls and monitors water pumping operations in urban water systems."
140,Smart Street Condition Monitoring,Street Safety,"Monitors the condition of streets and alerts for maintenance needs."
141,Smart Airflow Control,Air Ventilation,"Optimizes airflow in public areas for better air quality."
142,Smart Pedestrian Movement Detection,Traffic,"Monitors pedestrian movement and adjusts traffic lights accordingly."
143,Smart Public Transportation,Public Transport,"Monitors the operation of public transportation systems for better service."
144,Smart Industrial Park Monitoring,Industry,"Monitors activities and environmental conditions in industrial zones."
145,Smart Water Consumption Optimization,Water Management,"Monitors and optimizes water consumption in residential and commercial buildings."
146,Smart Building Waste Management,Building Management,"Monitors and optimizes waste management in commercial buildings."
147,Smart Road Monitoring,System Monitoring,"Monitors road usage and maintenance needs across city roads."
148,Smart Waste Sorting,Waste Management,"Monitors waste sorting to optimize recycling and waste disposal."
149,Smart Noise Pollution Detection,Noise Pollution,"Monitors areas with excessive noise pollution and adjusts mitigation strategies."
150,Smart Energy Grid Monitoring,Energy,"Monitors energy usage and distribution in the city's energy grid."
151,Smart Industrial Air Quality Monitoring,Air Quality,"Monitors industrial air emissions and air quality in urban industrial areas."
152,Smart Urban Light Control,Street Lighting,"Monitors and adjusts street lighting in real-time for efficiency and safety."
153,Smart Energy Usage Monitoring,Energy,"Monitors energy usage across urban facilities and buildings."
154,Smart Urban Plant Growth,Urban Agriculture,"Monitors and optimizes the growth conditions for urban plants and crops."
155,Smart River Water Monitoring,Water Quality,"Monitors water quality in rivers and lakes to ensure safety."
156,Smart Urban Smart Grid,Smart Grid,"Monitors and adjusts smart grid operations to optimize energy flow."
157,Smart Traffic Event Detection,Traffic,"Monitors traffic events such as accidents and roadblocks to adjust traffic signals."
158,Smart Vehicle Pollution Monitoring,Vehicle Emissions,"Monitors vehicle emissions across the city for better air quality management."
159,Smart Temperature Control,Building Management,"Monitors and optimizes indoor temperatures in public buildings."
160,Smart Park Monitoring,Park Management,"Monitors park conditions such as green space maintenance and visitor usage."
161,Smart Public Lighting,Street Lighting,"Monitors and controls street lighting for energy efficiency and safety."
162,Smart City Water Flow,Water Management,"Monitors water flow in city pipes to optimize distribution and minimize leaks."
163,Smart Community Interaction,System Monitoring,"Facilitates communication between city officials and residents using smart devices."
164,Smart Wind Energy Generation,Renewable Energy,"Monitors and optimizes the use of wind turbines for urban energy generation."
165,Smart Temperature Management,Building Management,"Monitors and optimizes temperature in urban buildings for comfort."
166,Smart Parking Ticketing System,Parking,"Monitors and manages parking tickets in real-time."
167,Smart Urban Flood Control,Flood Management,"Monitors urban areas for flood risk and controls flood gates in response."
168,Smart Energy Storage Optimization,Energy,"Optimizes the use of energy storage in the city for better efficiency."
169,Smart Vehicle Parking Availability,Parking,"Monitors parking space availability in real-time to help drivers find spots."
170,Smart City Waste Tracking,Waste Management,"Tracks waste generation and collection throughout the city for efficiency."
171,Smart Energy Grid Sensor,Smart Grid,"Monitors energy demand and supply within the city's smart grid."
172,Smart Public Hygiene Management,Public Hygiene,"Monitors and optimizes public hygiene efforts in high-traffic urban areas."
173,Smart Rainfall Detection,Weather Monitoring,"Detects rainfall levels in real-time to predict potential flooding."
174,Smart Traffic Speed Detection,Traffic,"Monitors the speed of vehicles in real-time to optimize traffic flow."
175,Smart Smart Home Integration,Home Automation,"Integrates IoT devices in homes with city infrastructure for energy efficiency."
176,Smart City Lighting,"Street Lighting,"Monitors and adjusts lighting systems across the city."
177,Smart Urban Vegetation Monitoring,Vegetation,"Monitors the health and growth of vegetation in urban green spaces."
178,Smart Public Facility Usage,Public Spaces,"Monitors the usage of public facilities like libraries, sports halls, and community centers."
179,Smart Urban Resource Management,Resource Management,"Monitors and optimizes the use of resources like water, energy, and waste."
180,Smart Traffic Signal Synchronization,Traffic,"Synchronizes traffic signals to optimize traffic flow and reduce congestion."
181,Smart Industrial Waste Monitoring,Industry,"Monitors industrial waste generation and its environmental impact."
182,Smart Renewable Energy Optimizer,Energy,"Optimizes the generation and consumption of renewable energy in urban environments."
183,Smart Green Space Maintenance,Green Spaces,"Monitors and maintains urban parks and green spaces for better public use."
184,Smart Data Collection Hub,Urban Management,"Centralizes data from various IoT devices across the city for analysis and decision-making."
185,Smart City Traffic Alerts,Traffic,"Sends real-time traffic alerts to drivers to avoid congestion."
186,Smart Building Air Ventilation,Indoor Air Quality,"Monitors air quality and optimizes ventilation in urban buildings."
187,Smart Agricultural Optimization,Urban Agriculture,"Monitors urban farming conditions and optimizes crop yield in cities."
188,Smart Water Flow Optimization,Water Management,"Monitors water flow to reduce wastage and optimize consumption."
189,Smart Emergency Response System,Public Safety,"Monitors emergency situations and deploys resources as needed."
190,Smart Multi-Modal Transport,Transport,"Integrates different transport modes to optimize city-wide transportation."
191,Smart Air Conditioning Control,Building Efficiency,"Monitors and adjusts air conditioning systems for optimal energy efficiency."
192,Smart Community Engagement,System Monitoring,"Enables residents to provide feedback and report issues in their communities."
193,Smart Urban Monitoring Platform,Urban Management,"Provides a platform for monitoring various IoT devices and sensors in a city."
194,Smart Park Lighting,Park Management,"Monitors and optimizes lighting in public parks to ensure safety and reduce energy use."
195,Smart Fire Safety System,Fire Safety,"Monitors and controls fire safety systems in urban environments."
196,Smart Water Pollution,Water Quality,"Monitors water quality in lakes, rivers, and reservoirs."
197,Smart Traffic Accident Detection,Traffic,"Detects traffic accidents and notifies emergency services immediately."
198,Smart Industrial Energy Efficiency,Industry,"Monitors and optimizes energy consumption in urban industrial zones."
199,Smart Urban Water Saving,Water Consumption,"Monitors and promotes water-saving measures in urban households and businesses."
200,Smart City Management Hub,Urban Management,"Coordinates and optimizes the functioning of smart city devices and systems."
